
Bus 002 Device 004: ID 8086:0a80 Intel Corp. 
Device Descriptor:
  bLength                18
  bDescriptorType         1
  bcdUSB               3.00
  bDeviceClass          239 Miscellaneous Device
  bDeviceSubClass         2 ?
  bDeviceProtocol         1 Interface Association
  bMaxPacketSize0         9
  idVendor           0x8086 Intel Corp.
  idProduct          0x0a80 
  bcdDevice           14.86
  iManufacturer           1 Intel Corp
  iProduct                2 Intel RealSense 3D Camera R200
  iSerial                 3 SN_2401005751
  bNumConfigurations      1
  Configuration Descriptor:
    bLength                 9
    bDescriptorType         2
    wTotalLength         1677
    bNumInterfaces          6
    bConfigurationValue     1
    iConfiguration          0 
    bmAttributes         0x80
      (Bus Powered)
    MaxPower              126mA
    Interface Association:
      bLength                 8
      bDescriptorType        11
      bFirstInterface         0
      bInterfaceCount         2
      bFunctionClass         14 Video
      bFunctionSubClass       3 Video Interface Collection
      bFunctionProtocol       0 
      iFunction               4 Intel(R) RealSense(TM) 3D Camera (R200) Left-Right
    Interface Descriptor:
      bLength                 9
      bDescriptorType         4
      bInterfaceNumber        0
      bAlternateSetting       0
      bNumEndpoints           0
      bInterfaceClass        14 Video
      bInterfaceSubClass      1 Video Control
      bInterfaceProtocol      0 
      iInterface              4 Intel(R) RealSense(TM) 3D Camera (R200) Left-Right
      VideoControl Interface Descriptor:
        bLength                13
        bDescriptorType        36
        bDescriptorSubtype      1 (HEADER)
        bcdUVC               1.10
        wTotalLength           68
        dwClockFrequency       48.000000MHz
        bInCollection           1
        baInterfaceNr( 0)       1
      VideoControl Interface Descriptor:
        bLength                18
        bDescriptorType        36
        bDescriptorSubtype      2 (INPUT_TERMINAL)
        bTerminalID             1
        wTerminalType      0x0201 Camera Sensor
        bAssocTerminal          0
        iTerminal               0 
        wObjectiveFocalLengthMin      0
        wObjectiveFocalLengthMax      0
        wOcularFocalLength            0
        bControlSize                  3
        bmControls           0x00000000
      VideoControl Interface Descriptor:
        bLength                28
        bDescriptorType        36
        bDescriptorSubtype      6 (EXTENSION_UNIT)
        bUnitID                 2
        guidExtensionCode         {342d6818-2cdd-7340-ad23-7214739a074c}
        bNumControl            21
        bNrPins                 1
        baSourceID( 0)          1
        bControlSize            3
        bmControls( 0)       0xfd
        bmControls( 1)       0xfb
        bmControls( 2)       0x7f
        iExtension              0 
      VideoControl Interface Descriptor:
        bLength                 9
        bDescriptorType        36
        bDescriptorSubtype      3 (OUTPUT_TERMINAL)
        bTerminalID             3
        wTerminalType      0x0101 USB Streaming
        bAssocTerminal          0
        bSourceID               2
        iTerminal               0 
    Interface Descriptor:
      bLength                 9
      bDescriptorType         4
      bInterfaceNumber        1
      bAlternateSetting       0
      bNumEndpoints           1
      bInterfaceClass        14 Video
      bInterfaceSubClass      2 Video Streaming
      bInterfaceProtocol      0 
      iInterface              4 Intel(R) RealSense(TM) 3D Camera (R200) Left-Right
      VideoStreaming Interface Descriptor:
        bLength                            18
        bDescriptorType                    36
        bDescriptorSubtype                  1 (INPUT_HEADER)
        bNumFormats                         5
        wTotalLength                      668
        bEndPointAddress                  134
        bmInfo                              0
        bTerminalLink                       3
        bStillCaptureMethod                 0
        bTriggerSupport                     0
        bTriggerUsage                       0
        bControlSize                        1
        bmaControls( 0)                    28
        bmaControls( 1)                    28
        bmaControls( 2)                    28
        bmaControls( 3)                    28
        bmaControls( 4)                    28
      VideoStreaming Interface Descriptor:
        bLength                            28
        bDescriptorType                    36
        bDescriptorSubtype                 16 (FORMAT_FRAME_BASED)
        bFormatIndex                        1
        bNumFrameDescriptors                1
        guidFormat                            {59555932-0000-1000-8000-00aa00389b71}
        bBitsPerPixel                      16
        bDefaultFrameIndex                  1
        bAspectRatioX                       0
        bAspectRatioY                       0
        bmInterlaceFlags                 0x00
          Interlaced stream or variable: No
          Fields per frame: 2 fields
          Field 1 first: No
          Field pattern: Field 1 only
          bCopyProtect                      0
          bVariableSize                     0
      VideoStreaming Interface Descriptor:
        bLength                            30
        bDescriptorType                    36
        bDescriptorSubtype                 17 (FRAME_FRAME_BASED)
        bFrameIndex                         1
        bmCapabilities                   0x00
          Still image unsupported
        wWidth                            320
        wHeight                           962
        dwMinBitRate                1329886080
        dwMaxBitRate                1329886080
        dwDefaultFrameInterval         166667
        bFrameIntervalType                  1
        dwBytesPerLine                      0
        dwFrameInterval( 0)            166667
      VideoStreaming Interface Descriptor:
        bLength                            28
        bDescriptorType                    36
        bDescriptorSubtype                 16 (FORMAT_FRAME_BASED)
        bFormatIndex                        2
        bNumFrameDescriptors                3
        guidFormat                            {59313249-0000-1000-8000-00aa00389b71}
        bBitsPerPixel                      24
        bDefaultFrameIndex                  2
        bAspectRatioX                       0
        bAspectRatioY                       0
        bmInterlaceFlags                 0x00
          Interlaced stream or variable: No
          Fields per frame: 2 fields
          Field 1 first: No
          Field pattern: Field 1 only
          bCopyProtect                      0
          bVariableSize                     0
      VideoStreaming Interface Descriptor:
        bLength                            38
        bDescriptorType                    36
        bDescriptorSubtype                 17 (FRAME_FRAME_BASED)
        bFrameIndex                         1
        bmCapabilities                   0x00
          Still image unsupported
        wWidth                            640
        wHeight                           481
        dwMinBitRate                664943040
        dwMaxBitRate                2216476800
        dwDefaultFrameInterval         166667
        bFrameIntervalType                  3
        dwBytesPerLine                      0
        dwFrameInterval( 0)            111111
        dwFrameInterval( 1)            166667
        dwFrameInterval( 2)            333333
      VideoStreaming Interface Descriptor:
        bLength                            38
        bDescriptorType                    36
        bDescriptorSubtype                 17 (FRAME_FRAME_BASED)
        bFrameIndex                         2
        bmCapabilities                   0x00
          Still image unsupported
        wWidth                            640
        wHeight                           373
        dwMinBitRate                664934400
        dwMaxBitRate                2216448000
        dwDefaultFrameInterval         166667
        bFrameIntervalType                  3
        dwBytesPerLine                      0
        dwFrameInterval( 0)            111111
        dwFrameInterval( 1)            166667
        dwFrameInterval( 2)            333333
      VideoStreaming Interface Descriptor:
        bLength                            38
        bDescriptorType                    36
        bDescriptorSubtype                 17 (FRAME_FRAME_BASED)
        bFrameIndex                         3
        bmCapabilities                   0x00
          Still image unsupported
        wWidth                            640
        wHeight                           254
        dwMinBitRate                664934400
        dwMaxBitRate                2216448000
        dwDefaultFrameInterval         166667
        bFrameIntervalType                  3
        dwBytesPerLine                      0
        dwFrameInterval( 0)            111111
        dwFrameInterval( 1)            166667
        dwFrameInterval( 2)            333333
      VideoStreaming Interface Descriptor:
        bLength                             6
        bDescriptorType                    36
        bDescriptorSubtype                 13 (COLORFORMAT)
        bColorPrimaries                     0 (Unspecified)
        bTransferCharacteristics            0 (Unspecified)
        bMatrixCoefficients                 0 (Unspecified)
      VideoStreaming Interface Descriptor:
        bLength                            28
        bDescriptorType                    36
        bDescriptorSubtype                 16 (FORMAT_FRAME_BASED)
        bFormatIndex                        3
        bNumFrameDescriptors                3
        guidFormat                            {59313620-0000-1000-8000-00aa00389b71}
        bBitsPerPixel                      16
        bDefaultFrameIndex                  2
        bAspectRatioX                       0
        bAspectRatioY                       0
        bmInterlaceFlags                 0x00
          Interlaced stream or variable: No
          Fields per frame: 2 fields
          Field 1 first: No
          Field pattern: Field 1 only
          bCopyProtect                      0
          bVariableSize                     0
      VideoStreaming Interface Descriptor:
        bLength                            38
        bDescriptorType                    36
        bDescriptorSubtype                 17 (FRAME_FRAME_BASED)
        bFrameIndex                         1
        bmCapabilities                   0x00
          Still image unsupported
        wWidth                            640
        wHeight                           481
        dwMinBitRate                1182117120
        dwMaxBitRate                3940390400
        dwDefaultFrameInterval         166667
        bFrameIntervalType                  3
        dwBytesPerLine                      0
        dwFrameInterval( 0)            111111
        dwFrameInterval( 1)            166667
        dwFrameInterval( 2)            333333
      VideoStreaming Interface Descriptor:
        bLength                            38
        bDescriptorType                    36
        bDescriptorSubtype                 17 (FRAME_FRAME_BASED)
        bFrameIndex                         2
        bmCapabilities                   0x00
          Still image unsupported
        wWidth                            640
        wHeight                           373
        dwMinBitRate                1182117120
        dwMaxBitRate                3940390400
        dwDefaultFrameInterval         166667
        bFrameIntervalType                  3
        dwBytesPerLine                      0
        dwFrameInterval( 0)            111111
        dwFrameInterval( 1)            166667
        dwFrameInterval( 2)            333333
      VideoStreaming Interface Descriptor:
        bLength                            38
        bDescriptorType                    36
        bDescriptorSubtype                 17 (FRAME_FRAME_BASED)
        bFrameIndex                         3
        bmCapabilities                   0x00
          Still image unsupported
        wWidth                            640
        wHeight                           254
        dwMinBitRate                1182117120
        dwMaxBitRate                3940390400
        dwDefaultFrameInterval         166667
        bFrameIntervalType                  3
        dwBytesPerLine                      0
        dwFrameInterval( 0)            111111
        dwFrameInterval( 1)            166667
        dwFrameInterval( 2)            333333
      VideoStreaming Interface Descriptor:
        bLength                             6
        bDescriptorType                    36
        bDescriptorSubtype                 13 (COLORFORMAT)
        bColorPrimaries                     0 (Unspecified)
        bTransferCharacteristics            0 (Unspecified)
        bMatrixCoefficients                 0 (Unspecified)
      VideoStreaming Interface Descriptor:
        bLength                            28
        bDescriptorType                    36
        bDescriptorSubtype                 16 (FORMAT_FRAME_BASED)
        bFormatIndex                        4
        bNumFrameDescriptors                3
        guidFormat                            {59384920-0000-1000-8000-00aa00389b71}
        bBitsPerPixel                      16
        bDefaultFrameIndex                  2
        bAspectRatioX                       0
        bAspectRatioY                       0
        bmInterlaceFlags                 0x00
          Interlaced stream or variable: No
          Fields per frame: 2 fields
          Field 1 first: No
          Field pattern: Field 1 only
          bCopyProtect                      0
          bVariableSize                     0
      VideoStreaming Interface Descriptor:
        bLength                            38
        bDescriptorType                    36
        bDescriptorSubtype                 17 (FRAME_FRAME_BASED)
        bFrameIndex                         1
        bmCapabilities                   0x00
          Still image unsupported
        wWidth                            640
        wHeight                           481
        dwMinBitRate                295532160
        dwMaxBitRate                985107200
        dwDefaultFrameInterval         166667
        bFrameIntervalType                  3
        dwBytesPerLine                      0
        dwFrameInterval( 0)            111111
        dwFrameInterval( 1)            166667
        dwFrameInterval( 2)            333333
      VideoStreaming Interface Descriptor:
        bLength                            38
        bDescriptorType                    36
        bDescriptorSubtype                 17 (FRAME_FRAME_BASED)
        bFrameIndex                         2
        bmCapabilities                   0x00
          Still image unsupported
        wWidth                            640
        wHeight                           373
        dwMinBitRate                295532160
        dwMaxBitRate                985107200
        dwDefaultFrameInterval         166667
        bFrameIntervalType                  3
        dwBytesPerLine                      0
        dwFrameInterval( 0)            111111
        dwFrameInterval( 1)            166667
        dwFrameInterval( 2)            333333
      VideoStreaming Interface Descriptor:
        bLength                            38
        bDescriptorType                    36
        bDescriptorSubtype                 17 (FRAME_FRAME_BASED)
        bFrameIndex                         3
        bmCapabilities                   0x00
          Still image unsupported
        wWidth                            640
        wHeight                           254
        dwMinBitRate                295532160
        dwMaxBitRate                985107200
        dwDefaultFrameInterval         166667
        bFrameIntervalType                  3
        dwBytesPerLine                      0
        dwFrameInterval( 0)            111111
        dwFrameInterval( 1)            166667
        dwFrameInterval( 2)            333333
      VideoStreaming Interface Descriptor:
        bLength                             6
        bDescriptorType                    36
        bDescriptorSubtype                 13 (COLORFORMAT)
        bColorPrimaries                     0 (Unspecified)
        bTransferCharacteristics            0 (Unspecified)
        bMatrixCoefficients                 0 (Unspecified)
      VideoStreaming Interface Descriptor:
        bLength                            28
        bDescriptorType                    36
        bDescriptorSubtype                 16 (FORMAT_FRAME_BASED)
        bFormatIndex                        5
        bNumFrameDescriptors                3
        guidFormat                            {59382020-0000-1000-8000-00aa00389b71}
        bBitsPerPixel                       8
        bDefaultFrameIndex                  2
        bAspectRatioX                       0
        bAspectRatioY                       0
        bmInterlaceFlags                 0x00
          Interlaced stream or variable: No
          Fields per frame: 2 fields
          Field 1 first: No
          Field pattern: Field 1 only
          bCopyProtect                      0
          bVariableSize                     0
      VideoStreaming Interface Descriptor:
        bLength                            38
        bDescriptorType                    36
        bDescriptorSubtype                 17 (FRAME_FRAME_BASED)
        bFrameIndex                         1
        bmCapabilities                   0x00
          Still image unsupported
        wWidth                            640
        wHeight                           481
        dwMinBitRate                 73881600
        dwMaxBitRate                246272000
        dwDefaultFrameInterval         166667
        bFrameIntervalType                  3
        dwBytesPerLine                      0
        dwFrameInterval( 0)            111111
        dwFrameInterval( 1)            166667
        dwFrameInterval( 2)            333333
      VideoStreaming Interface Descriptor:
        bLength                            38
        bDescriptorType                    36
        bDescriptorSubtype                 17 (FRAME_FRAME_BASED)
        bFrameIndex                         2
        bmCapabilities                   0x00
          Still image unsupported
        wWidth                            640
        wHeight                           373
        dwMinBitRate                 73881600
        dwMaxBitRate                246272000
        dwDefaultFrameInterval         166667
        bFrameIntervalType                  3
        dwBytesPerLine                      0
        dwFrameInterval( 0)            111111
        dwFrameInterval( 1)            166667
        dwFrameInterval( 2)            333333
      VideoStreaming Interface Descriptor:
        bLength                            38
        bDescriptorType                    36
        bDescriptorSubtype                 17 (FRAME_FRAME_BASED)
        bFrameIndex                         3
        bmCapabilities                   0x00
          Still image unsupported
        wWidth                            640
        wHeight                           254
        dwMinBitRate                 73881600
        dwMaxBitRate                246272000
        dwDefaultFrameInterval         166667
        bFrameIntervalType                  3
        dwBytesPerLine                      0
        dwFrameInterval( 0)            111111
        dwFrameInterval( 1)            166667
        dwFrameInterval( 2)            333333
      VideoStreaming Interface Descriptor:
        bLength                             6
        bDescriptorType                    36
        bDescriptorSubtype                 13 (COLORFORMAT)
        bColorPrimaries                     0 (Unspecified)
        bTransferCharacteristics            0 (Unspecified)
        bMatrixCoefficients                 0 (Unspecified)
      Endpoint Descriptor:
        bLength                 7
        bDescriptorType         5
        bEndpointAddress     0x86  EP 6 IN
        bmAttributes            2
          Transfer Type            Bulk
          Synch Type               None
          Usage Type               Data
        wMaxPacketSize     0x0400  1x 1024 bytes
        bInterval               0
        bMaxBurst               0
    Interface Association:
      bLength                 8
      bDescriptorType        11
      bFirstInterface         2
      bInterfaceCount         2
      bFunctionClass         14 Video
      bFunctionSubClass       3 Video Interface Collection
      bFunctionProtocol       0 
      iFunction               5 Intel(R) RealSense(TM) 3D Camera (R200) Depth
    Interface Descriptor:
      bLength                 9
      bDescriptorType         4
      bInterfaceNumber        2
      bAlternateSetting       0
      bNumEndpoints           1
      bInterfaceClass        14 Video
      bInterfaceSubClass      1 Video Control
      bInterfaceProtocol      0 
      iInterface              5 Intel(R) RealSense(TM) 3D Camera (R200) Depth
      VideoControl Interface Descriptor:
        bLength                13
        bDescriptorType        36
        bDescriptorSubtype      1 (HEADER)
        bcdUVC               1.10
        wTotalLength           40
        dwClockFrequency       48.000000MHz
        bInCollection           1
        baInterfaceNr( 0)       3
      VideoControl Interface Descriptor:
        bLength                18
        bDescriptorType        36
        bDescriptorSubtype      2 (INPUT_TERMINAL)
        bTerminalID             4
        wTerminalType      0x0201 Camera Sensor
        bAssocTerminal          0
        iTerminal               0 
        wObjectiveFocalLengthMin      0
        wObjectiveFocalLengthMax      0
        wOcularFocalLength            0
        bControlSize                  3
        bmControls           0x00000000
      VideoControl Interface Descriptor:
        bLength                 9
        bDescriptorType        36
        bDescriptorSubtype      3 (OUTPUT_TERMINAL)
        bTerminalID             5
        wTerminalType      0x0101 USB Streaming
        bAssocTerminal          0
        bSourceID               4
        iTerminal               0 
      Endpoint Descriptor:
        bLength                 7
        bDescriptorType         5
        bEndpointAddress     0x82  EP 2 IN
        bmAttributes            3
          Transfer Type            Interrupt
          Synch Type               None
          Usage Type               Data
        wMaxPacketSize     0x0040  1x 64 bytes
        bInterval               8
        bMaxBurst               0
    Interface Descriptor:
      bLength                 9
      bDescriptorType         4
      bInterfaceNumber        3
      bAlternateSetting       0
      bNumEndpoints           1
      bInterfaceClass        14 Video
      bInterfaceSubClass      2 Video Streaming
      bInterfaceProtocol      0 
      iInterface              5 Intel(R) RealSense(TM) 3D Camera (R200) Depth
      VideoStreaming Interface Descriptor:
        bLength                            15
        bDescriptorType                    36
        bDescriptorSubtype                  1 (INPUT_HEADER)
        bNumFormats                         2
        wTotalLength                      227
        bEndPointAddress                  133
        bmInfo                              0
        bTerminalLink                       5
        bStillCaptureMethod                 0
        bTriggerSupport                     0
        bTriggerUsage                       0
        bControlSize                        1
        bmaControls( 0)                    28
        bmaControls( 1)                    28
      VideoStreaming Interface Descriptor:
        bLength                            28
        bDescriptorType                    36
        bDescriptorSubtype                 16 (FORMAT_FRAME_BASED)
        bFormatIndex                        1
        bNumFrameDescriptors                1
        guidFormat                            {59555932-0000-1000-8000-00aa00389b71}
        bBitsPerPixel                      16
        bDefaultFrameIndex                  1
        bAspectRatioX                       0
        bAspectRatioY                       0
        bmInterlaceFlags                 0x00
          Interlaced stream or variable: No
          Fields per frame: 2 fields
          Field 1 first: No
          Field pattern: Field 1 only
          bCopyProtect                      0
          bVariableSize                     0
      VideoStreaming Interface Descriptor:
        bLength                            30
        bDescriptorType                    36
        bDescriptorSubtype                 17 (FRAME_FRAME_BASED)
        bFrameIndex                         1
        bmCapabilities                   0x00
          Still image unsupported
        wWidth                            314
        wHeight                           938
        dwMinBitRate                565512960
        dwMaxBitRate                565512960
        dwDefaultFrameInterval         166667
        bFrameIntervalType                  1
        dwBytesPerLine                      0
        dwFrameInterval( 0)            166667
      VideoStreaming Interface Descriptor:
        bLength                             6
        bDescriptorType                    36
        bDescriptorSubtype                 13 (COLORFORMAT)
        bColorPrimaries                     0 (Unspecified)
        bTransferCharacteristics            0 (Unspecified)
        bMatrixCoefficients                 0 (Unspecified)
      VideoStreaming Interface Descriptor:
        bLength                            28
        bDescriptorType                    36
        bDescriptorSubtype                 16 (FORMAT_FRAME_BASED)
        bFormatIndex                        2
        bNumFrameDescriptors                3
        guidFormat                            {5a313620-0000-1000-8000-00aa00389b71}
        bBitsPerPixel                      16
        bDefaultFrameIndex                  2
        bAspectRatioX                       0
        bAspectRatioY                       0
        bmInterlaceFlags                 0x00
          Interlaced stream or variable: No
          Fields per frame: 2 fields
          Field 1 first: No
          Field pattern: Field 1 only
          bCopyProtect                      0
          bVariableSize                     0
      VideoStreaming Interface Descriptor:
        bLength                            38
        bDescriptorType                    36
        bDescriptorSubtype                 17 (FRAME_FRAME_BASED)
        bFrameIndex                         1
        bmCapabilities                   0x00
          Still image unsupported
        wWidth                            628
        wHeight                           469
        dwMinBitRate                282756480
        dwMaxBitRate                942521600
        dwDefaultFrameInterval         166667
        bFrameIntervalType                  3
        dwBytesPerLine                      0
        dwFrameInterval( 0)            111111
        dwFrameInterval( 1)            166667
        dwFrameInterval( 2)            333333
      VideoStreaming Interface Descriptor:
        bLength                            38
        bDescriptorType                    36
        bDescriptorSubtype                 17 (FRAME_FRAME_BASED)
        bFrameIndex                         2
        bmCapabilities                   0x00
          Still image unsupported
        wWidth                            628
        wHeight                           361
        dwMinBitRate                282750720
        dwMaxBitRate                942521600
        dwDefaultFrameInterval         166667
        bFrameIntervalType                  3
        dwBytesPerLine                      0
        dwFrameInterval( 0)            111111
        dwFrameInterval( 1)            166667
        dwFrameInterval( 2)            333333
      VideoStreaming Interface Descriptor:
        bLength                            38
        bDescriptorType                    36
        bDescriptorSubtype                 17 (FRAME_FRAME_BASED)
        bFrameIndex                         3
        bmCapabilities                   0x00
          Still image unsupported
        wWidth                            628
        wHeight                           242
        dwMinBitRate                339300864
        dwMaxBitRate                1131025920
        dwDefaultFrameInterval         166667
        bFrameIntervalType                  3
        dwBytesPerLine                      0
        dwFrameInterval( 0)            111111
        dwFrameInterval( 1)            166667
        dwFrameInterval( 2)            333333
      VideoStreaming Interface Descriptor:
        bLength                             6
        bDescriptorType                    36
        bDescriptorSubtype                 13 (COLORFORMAT)
        bColorPrimaries                     0 (Unspecified)
        bTransferCharacteristics            0 (Unspecified)
        bMatrixCoefficients                 0 (Unspecified)
      Endpoint Descriptor:
        bLength                 7
        bDescriptorType         5
        bEndpointAddress     0x85  EP 5 IN
        bmAttributes            2
          Transfer Type            Bulk
          Synch Type               None
          Usage Type               Data
        wMaxPacketSize     0x0400  1x 1024 bytes
        bInterval               0
        bMaxBurst               0
    Interface Association:
      bLength                 8
      bDescriptorType        11
      bFirstInterface         4
      bInterfaceCount         2
      bFunctionClass         14 Video
      bFunctionSubClass       3 Video Interface Collection
      bFunctionProtocol       0 
      iFunction               6 Intel(R) RealSense(TM) 3D Camera (R200) RGB
    Interface Descriptor:
      bLength                 9
      bDescriptorType         4
      bInterfaceNumber        4
      bAlternateSetting       0
      bNumEndpoints           1
      bInterfaceClass        14 Video
      bInterfaceSubClass      1 Video Control
      bInterfaceProtocol      0 
      iInterface              6 Intel(R) RealSense(TM) 3D Camera (R200) RGB
      VideoControl Interface Descriptor:
        bLength                13
        bDescriptorType        36
        bDescriptorSubtype      1 (HEADER)
        bcdUVC               1.10
        wTotalLength           53
        dwClockFrequency       48.000000MHz
        bInCollection           1
        baInterfaceNr( 0)       5
      VideoControl Interface Descriptor:
        bLength                18
        bDescriptorType        36
        bDescriptorSubtype      2 (INPUT_TERMINAL)
        bTerminalID             6
        wTerminalType      0x0201 Camera Sensor
        bAssocTerminal          0
        iTerminal               0 
        wObjectiveFocalLengthMin      0
        wObjectiveFocalLengthMax      0
        wOcularFocalLength            0
        bControlSize                  3
        bmControls           0x0000000a
          Auto-Exposure Mode
          Exposure Time (Absolute)
      VideoControl Interface Descriptor:
        bLength                13
        bDescriptorType        36
        bDescriptorSubtype      5 (PROCESSING_UNIT)
        bUnitID                 7
        bSourceID               6
        wMaxMultiplier      16384
        bControlSize            3
        bmControls     0x0000177f
          Brightness
          Contrast
          Hue
          Saturation
          Sharpness
          Gamma
          White Balance Temperature
          Backlight Compensation
          Gain
          Power Line Frequency
          White Balance Temperature, Auto
        iProcessing             0 
        bmVideoStandards     0x 0
      VideoControl Interface Descriptor:
        bLength                 9
        bDescriptorType        36
        bDescriptorSubtype      3 (OUTPUT_TERMINAL)
        bTerminalID             8
        wTerminalType      0x0101 USB Streaming
        bAssocTerminal          0
        bSourceID               7
        iTerminal               0 
      Endpoint Descriptor:
        bLength                 7
        bDescriptorType         5
        bEndpointAddress     0x81  EP 1 IN
        bmAttributes            3
          Transfer Type            Interrupt
          Synch Type               None
          Usage Type               Data
        wMaxPacketSize     0x0040  1x 64 bytes
        bInterval               8
        bMaxBurst               0
    Interface Descriptor:
      bLength                 9
      bDescriptorType         4
      bInterfaceNumber        5
      bAlternateSetting       0
      bNumEndpoints           1
      bInterfaceClass        14 Video
      bInterfaceSubClass      2 Video Streaming
      bInterfaceProtocol      0 
      iInterface              6 Intel(R) RealSense(TM) 3D Camera (R200) RGB
      VideoStreaming Interface Descriptor:
        bLength                            15
        bDescriptorType                    36
        bDescriptorSubtype                  1 (INPUT_HEADER)
        bNumFormats                         2
        wTotalLength                      427
        bEndPointAddress                  135
        bmInfo                              0
        bTerminalLink                       8
        bStillCaptureMethod                 0
        bTriggerSupport                     0
        bTriggerUsage                       0
        bControlSize                        1
        bmaControls( 0)                    28
        bmaControls( 1)                    28
      VideoStreaming Interface Descriptor:
        bLength                            28
        bDescriptorType                    36
        bDescriptorSubtype                 16 (FORMAT_FRAME_BASED)
        bFormatIndex                        1
        bNumFrameDescriptors                9
        guidFormat                            {59555932-0000-1000-8000-00aa00389b71}
        bBitsPerPixel                      16
        bDefaultFrameIndex                  5
        bAspectRatioX                       0
        bAspectRatioY                       0
        bmInterlaceFlags                 0x00
          Interlaced stream or variable: No
          Fields per frame: 2 fields
          Field 1 first: No
          Field pattern: Field 1 only
          bCopyProtect                      0
          bVariableSize                     0
      VideoStreaming Interface Descriptor:
        bLength                            34
        bDescriptorType                    36
        bDescriptorSubtype                 17 (FRAME_FRAME_BASED)
        bFrameIndex                         1
        bmCapabilities                   0x00
          Still image unsupported
        wWidth                           1920
        wHeight                          1080
        dwMinBitRate                995330880
        dwMaxBitRate                1990661760
        dwDefaultFrameInterval         333333
        bFrameIntervalType                  2
        dwBytesPerLine                      0
        dwFrameInterval( 0)            333333
        dwFrameInterval( 1)            666667
      VideoStreaming Interface Descriptor:
        bLength                            34
        bDescriptorType                    36
        bDescriptorSubtype                 17 (FRAME_FRAME_BASED)
        bFrameIndex                         2
        bmCapabilities                   0x00
          Still image unsupported
        wWidth                           1280
        wHeight                           720
        dwMinBitRate                502370880
        dwMaxBitRate                994741760
        dwDefaultFrameInterval         333333
        bFrameIntervalType                  2
        dwBytesPerLine                      0
        dwFrameInterval( 0)            333333
        dwFrameInterval( 1)            666667
      VideoStreaming Interface Descriptor:
        bLength                            34
        bDescriptorType                    36
        bDescriptorSubtype                 17 (FRAME_FRAME_BASED)
        bFrameIndex                         3
        bmCapabilities                   0x00
          Still image unsupported
        wWidth                            960
        wHeight                           540
        dwMinBitRate                248834880
        dwMaxBitRate                497669760
        dwDefaultFrameInterval         333333
        bFrameIntervalType                  2
        dwBytesPerLine                      0
        dwFrameInterval( 0)            333333
        dwFrameInterval( 1)            666667
      VideoStreaming Interface Descriptor:
        bLength                            34
        bDescriptorType                    36
        bDescriptorSubtype                 17 (FRAME_FRAME_BASED)
        bFrameIndex                         4
        bmCapabilities                   0x00
          Still image unsupported
        wWidth                            848
        wHeight                           480
        dwMinBitRate                195382080
        dwMaxBitRate                390764160
        dwDefaultFrameInterval         333333
        bFrameIntervalType                  2
        dwBytesPerLine                      0
        dwFrameInterval( 0)            333333
        dwFrameInterval( 1)            666667
      VideoStreaming Interface Descriptor:
        bLength                            38
        bDescriptorType                    36
        bDescriptorSubtype                 17 (FRAME_FRAME_BASED)
        bFrameIndex                         5
        bmCapabilities                   0x00
          Still image unsupported
        wWidth                            640
        wHeight                           480
        dwMinBitRate                147458880
        dwMaxBitRate                589835520
        dwDefaultFrameInterval         333333
        bFrameIntervalType                  3
        dwBytesPerLine                      0
        dwFrameInterval( 0)            166667
        dwFrameInterval( 1)            333333
        dwFrameInterval( 2)            666667
      VideoStreaming Interface Descriptor:
        bLength                            34
        bDescriptorType                    36
        bDescriptorSubtype                 17 (FRAME_FRAME_BASED)
        bFrameIndex                         6
        bmCapabilities                   0x00
          Still image unsupported
        wWidth                            640
        wHeight                           360
        dwMinBitRate                110594880
        dwMaxBitRate                221189760
        dwDefaultFrameInterval         333333
        bFrameIntervalType                  2
        dwBytesPerLine                      0
        dwFrameInterval( 0)            333333
        dwFrameInterval( 1)            666667
      VideoStreaming Interface Descriptor:
        bLength                            34
        bDescriptorType                    36
        bDescriptorSubtype                 17 (FRAME_FRAME_BASED)
        bFrameIndex                         7
        bmCapabilities                   0x00
          Still image unsupported
        wWidth                            424
        wHeight                           240
        dwMinBitRate                 48847680
        dwMaxBitRate                 97695360
        dwDefaultFrameInterval         333333
        bFrameIntervalType                  2
        dwBytesPerLine                      0
        dwFrameInterval( 0)            333333
        dwFrameInterval( 1)            666667
      VideoStreaming Interface Descriptor:
        bLength                            38
        bDescriptorType                    36
        bDescriptorSubtype                 17 (FRAME_FRAME_BASED)
        bFrameIndex                         8
        bmCapabilities                   0x00
          Still image unsupported
        wWidth                            320
        wHeight                           240
        dwMinBitRate                 36866880
        dwMaxBitRate                147467520
        dwDefaultFrameInterval         333333
        bFrameIntervalType                  3
        dwBytesPerLine                      0
        dwFrameInterval( 0)            166667
        dwFrameInterval( 1)            333333
        dwFrameInterval( 2)            666667
      VideoStreaming Interface Descriptor:
        bLength                            34
        bDescriptorType                    36
        bDescriptorSubtype                 17 (FRAME_FRAME_BASED)
        bFrameIndex                         9
        bmCapabilities                   0x00
          Still image unsupported
        wWidth                            320
        wHeight                           180
        dwMinBitRate                 27650880
        dwMaxBitRate                 55301760
        dwDefaultFrameInterval         333333
        bFrameIntervalType                  2
        dwBytesPerLine                      0
        dwFrameInterval( 0)            333333
        dwFrameInterval( 1)            666667
      VideoStreaming Interface Descriptor:
        bLength                             6
        bDescriptorType                    36
        bDescriptorSubtype                 13 (COLORFORMAT)
        bColorPrimaries                     0 (Unspecified)
        bTransferCharacteristics            0 (Unspecified)
        bMatrixCoefficients                 0 (Unspecified)
      VideoStreaming Interface Descriptor:
        bLength                            28
        bDescriptorType                    36
        bDescriptorSubtype                 16 (FORMAT_FRAME_BASED)
        bFormatIndex                        2
        bNumFrameDescriptors                1
        guidFormat                            {52573130-0000-1000-8000-00aa00389b71}
        bBitsPerPixel                       8
        bDefaultFrameIndex                  1
        bAspectRatioX                       0
        bAspectRatioY                       0
        bmInterlaceFlags                 0x00
          Interlaced stream or variable: No
          Fields per frame: 2 fields
          Field 1 first: No
          Field pattern: Field 1 only
          bCopyProtect                      0
          bVariableSize                     0
      VideoStreaming Interface Descriptor:
        bLength                            30
        bDescriptorType                    36
        bDescriptorSubtype                 17 (FRAME_FRAME_BASED)
        bFrameIndex                         1
        bmCapabilities                   0x00
          Still image unsupported
        wWidth                           2400
        wHeight                          1081
        dwMinBitRate                1245317760
        dwMaxBitRate                1245317760
        dwDefaultFrameInterval         333333
        bFrameIntervalType                  1
        dwBytesPerLine                      0
        dwFrameInterval( 0)            333333
      VideoStreaming Interface Descriptor:
        bLength                             6
        bDescriptorType                    36
        bDescriptorSubtype                 13 (COLORFORMAT)
        bColorPrimaries                     0 (Unspecified)
        bTransferCharacteristics            0 (Unspecified)
        bMatrixCoefficients                 0 (Unspecified)
      Endpoint Descriptor:
        bLength                 7
        bDescriptorType         5
        bEndpointAddress     0x87  EP 7 IN
        bmAttributes            2
          Transfer Type            Bulk
          Synch Type               None
          Usage Type               Data
        wMaxPacketSize     0x0400  1x 1024 bytes
        bInterval               0
        bMaxBurst               0
        ** UNRECOGNIZED:  20 ff 42 49 53 54 00 01 04 07 02 00 00 00 00 00 01 08 e8 03 02 09 e8 03 03 0a e8 03 04 0b 4c 04
Binary Object Store Descriptor:
  bLength                 5
  bDescriptorType        15
  wTotalLength           22
  bNumDeviceCaps          2
  USB 2.0 Extension Device Capability:
    bLength                 7
    bDescriptorType        16
    bDevCapabilityType      2
    bmAttributes   0x00000002
      Link Power Management (LPM) Supported
  SuperSpeed USB Device Capability:
    bLength                10
    bDescriptorType        16
    bDevCapabilityType      3
    bmAttributes         0x02
      Latency Tolerance Messages (LTM) Supported
    wSpeedsSupported   0x0008
      Device can operate at SuperSpeed (5Gbps)
    bFunctionalitySupport   3
      Lowest fully-functional device speed is SuperSpeed (5Gbps)
    bU1DevExitLat          10 micro seconds
    bU2DevExitLat        2047 micro seconds
Device Status:     0x0000
  (Bus Powered)
